Title,Price
"BBQ and Bacon Salad Kit, Chop Chop",$4.98
"Teriyaki Salad Kit, Chop Chop",$4.98
"Chicken Flavoured Cat Treats, Value Pack",$7.99
"Seafood Medley Flavoured Cat Treats, Value Pack",$7.99
Mango and Poblano Pepper Salsa,$4.44
"Frozen Original Waffles, Value Pack",$7.49
"Six Bean Mix, Life Smart",$1.49
Unsweetened Medium Desiccated Coconut,$1.99
Sea Salted Oven Roasted Deluxe Mixed Nuts,$11.88
Apple and Berry Sauce Pouches,$3.99
California Sun-Dried Raisins,$4.99
Sweetened Apple and Peach Sauce Snacks,$2.29
"Pecan Pie, Artisan",$7.99
Vegetable Cocktail,$2.99
"Coconut Macaroons with Chocolate Drizzle, Value Pack",$6.99
Chocolate Marble Loaf Cake Slices,$4.99
Sunflower and Crunchy Bacon Salad Kit,$4.98
Vanilla Flavoured Oat Beverage,$3.49
Corn and Black Bean Salsa,$4.44
Frozen Maple Belgian Waffles,$3.99
Blackberries,$4.98
White Mushrooms,$2.67
Frozen Onion Hash Brown Patties,$3.99
"Frozen Quattro Formaggi Thin Crust Pizza, Gusto Ital...",$3.97
Sweetened Apple and Raspberry Sauce Snacks,$2.29
Chocolate Flavoured Almond Beverage,$4.49
California Sun-Dried Raisins,$6.49
"Berry Flavoured Fruit & Veggie Snacks, Fruitsations",$3.99
"Frozen Pecan, Caramel and Chocolate New York Style C...",$11.49
"Frozen Waffles, Gluten Free",$2.77
Original Flavour Oat Beverage,$3.49
Unscented Clumping Cat Litter,$9.99
"Frozen Margherita Pizza on Cauliflower Crust, Naturalia",$8.47
Frozen Organic Pad Thai,$7.49
Granola Trail Mix,$3.49
Chopped Walnuts,$2.77
Coconut Milk,$1.79
Frozen Profiteroles,$8.99
Frozen Hashbrown Potatoes,$2.49
Pine Nuts,$7.99
Frozen Lemon Cream Pie,$11.99
"Dark Red Kidney Beans, Life Smart",$1.49
Unsweetened Original Flavour Almond Beverage,$4.49
Unsalted Dry Roasted Deluxe Mixed Nuts,$11.88
Sweetened Apple and Strawberry Sauce Snacks,$2.29
"Assorted Fruit & Veggie Flavoured Snacks, Fruitsations",$3.99
Vanilla Flavoured Oat Beverage,$4.49
Vanilla Almond Plant-Based Coffee Whitener,$5.49
Frozen Vanilla Belgian Waffles,$3.99
Wild Mix with No Salt Added,$7.98
"Dark Chocolate, Fruit and Nuts Premium Mix",$9.88
Mixed Nuts and Peanuts,$12.88
Frozen Organic Chicken Fillets,$14.99
Frozen New York Style Cheesecake Assortment,$17.99
Unsweetened Vanilla Flavoured Almond Beverage,$4.49
Mild Salsa,$2.99
"Whole Grain Oats Cereal, Life",$3.99
"Meal Replacement Cereal, Vector",$6.49
Sweetened Apple Sauce Snacks,$2.29
Unsweetened Vanilla Flavoured Organic Almond Beverag...,$4.49
"Barista Soy Beverage, Barista Edition",$3.49
"Oat Beverage, Barista Edition",$5.99
Vanilla Oat Plant-Based Coffee Whitener,$5.49
Apple Maple Cranberry Pie,$7.99
"Dried Fruit and Nut Mix, Super",$7.98
Unsalted Deluxe Nut Mix,$7.98
"Frozen Chocolate Cake, Deep'n Delicious",$6.99
"Frozen Potato Pancakes, Breakfast",$4.99
Frozen Mini Chocolate Eclairs,$8.99
"Crunchy Oat Cereal, Squares",$4.99
Frozen Caramelized Onion & Sundried Tomato Thin Crus...,$3.97
Frozen Tiramisu Cake,$7.99
"Organic Ancient Grains Cereal, Heritage Flakes",$9.99
Medium Salsa,$4.99
Frozen Potato Patties,$3.99
"Frozen Marble Cake, Deep'n Delicious",$6.99
"Buds Cereal, All-Bran",$6.99
Original Flavour Oat Beverage,$4.49
"Frozen Mini Hazelnut and Chocolate Mousses, Mini Mousse",$8.49
Mild Salsa,$4.99
"Frozen Mushroom Thin Crust Pizza, Ristorante",$6.29
"Frozen Vegetable Thin Crust Pizza, Ristorante",$6.29
"Frozen Spinach Thin Crust Pizza, Gusto Italiano",$3.97
"Whole Grain Wheat Cereal with Bran, Shredded Wheat",$4.99
Unsweetened Original Flavour Organic Almond Beverage...,$4.49
Medium Salsa,$4.44
Mild Salsa,$4.44
"Frozen Thin Crust Margherita Pizza, Gusto Italiano",$3.97
"Frozen Mascarpone Mushroom Thin Crust Pizza, Gusto I...",$3.97
"Meal Replacement Cereal Jumbo Size, Vector",$9.99
"Frozen Spinach Thin Crust Pizza, Ristorante",$6.29
Frozen Hash Brown Patties,$6.49
Walnuts,$4.98
Frozen Vegetable Spring Rolls,$4.99
