Title,Price
Red Food Colouring,$2.99
Green Food Colouring,$2.99
Beef Dog Food,$36.99
"Dry Cat Food, Original Choice",$7.49
"Natural Food Seasoning, Vegeta",$4.49
Assorted Flavours Dog Food,$18.99
Salmon Wet Cat Food,$0.99
"Wet Cat Food Pâté, Chef's Dinner",$0.99
"Salmon Wet Cat Food, Pâté",$0.99
"Chicken Wet Cat Food, Pâté",$0.99
"Salmon Wet Cat Food, Grilled",$0.99
"Seafood Wet Cat Food, Pâté",$0.99
"Tuna Wet Cat Food, Flaked",$0.99
"Meat Adult Cat Food, Meaty Selections",$18.99
"Chicken Flavoured Dog Food, ProActive Health",$18.99
"Beef Dry Dog Food, Originals",$44.99
"Chicken Dry Dog Food, Originals",$8.49
"Adult Dry Dog Food, Cookout Classics",$19.99
"Beef Dry Dog Food, Originals",$26.99
"Chicken Dry Dog Food, Originals",$26.99
"Salmon Dry Dog Food, Originals",$26.99
"Chicken Dry Dog Food, Healthy Weight",$26.99
"Adult Dry Dog Food, Cookout Classics",$38.99
"Chicken Dry Cat Food, Complete",$26.99
Chicken Wet Cat Food,$0.99
"Dry Puppy Food with Chicken, Complete",$22.49
Mini Angel Food Cakes,$5.99
Food Basics Reusable Bag,$0.99
Mini food waste bags,$13.99
Small food waste bags,$5.99
"Chicken and Duck Wet Dog Food, True Instinct",$2.79
"Chicken Stew Wet Dog Food, Prepared Meals",$2.99
Salmon and Shrimp Cat Food Pâté,$0.99
"Chicken and Salmon Wet Cat Food, Shredded",$0.99
"Chicken in Gravy Wet Cat Food, Chunks",$0.99
Lamb and Rice Dry Dog Food,$50.99
"Tuna in Gravy Wet Cat Food, Grilled",$0.99
"Liver and Chicken Wet Cat Food, Pâté",$0.99
"Turkey and Giblets Wet Cat Food, Pâté",$0.99
"Hairball care dry cat food, Proactive Health",$15.99
"Tuna Flavoured pâté cat food, Perfect Portions,Healt...",$1.79
"Chicken Flavoured Adult Cat Food, Meaty Selections",$9.99
"Chicken Flavoured pâté cat food,  Perfect Portions,H...",$1.79
"Salmon Flavoued pâté cat food, Perfect Portions,Heal...",$1.79
"Chicken Flavoured Dry Dog Food, Proteine 1",$29.99
"Beef Flavoured Dry Dog Food, Proteine 1",$29.99
Chicken Flavoured Dry Dog Food,$12.49
"Chicken Flavoured Adult Cat Food, Meaty Selections",$35.99
3 Flavours Dry Cat Food,$21.99
7 Flavours Dry Cat Food,$6.99
"Chicken and Barley Dry Dog Food, Simply",$12.99
"7 Flavours Dry Cat Food, Chef's Blend",$6.99
"Chicken and Salmon Dry Cat Food, Gravy Swirlers",$6.99
"Dry Cat Food with Real Chicken, Complete",$17.99
7 Flavours Dry Cat Food,$12.99
"Dry Puppy Food with Real Chicken, Complete",$7.99
"Turkey and Venison Dry Dog Food, True Instinct",$31.99
Chicken and Rice Dry Dog Food,$31.99
Lamb and Rice Dry Dog Food,$31.99
"Turkey and Giblets Wet Cat Food, Pâté",$0.99
"Turkey in Gravy Wet Cat Food, Prime Filets",$0.99
"Turkey and Cheese Wet Cat Food, Shredded",$0.99
"Wet Cat Food Variety Pack, Ocean Delights",$21.99
"Cat Food Paté with Chicken Bites, Chunky",$0.99
Beef Wet Cat Food Paté,$0.99
"Wet Cat Food Variety Pack, Grilled in Gravy",$11.49
"Beef and Bison Wet Dog Food, True Instinct",$2.79
"Wet Cat Food Variety Pack, Seafood Lovers",$21.99
"Wet Cat Food Variety Pack, Poultry Lovers",$21.99
"Wet Cat Food Variety Pack, Gravy Pleasers",$21.99
"Wet Cat Food Variety Pack, Tasty Treasures",$21.99
Chicken and Brown Rice Dog Food,$59.99
"Devil's Food Flavoured Cake Mix, SuperMoist",$2.29
Large compostable food waste bags,$7.99
"Chicken and Brown Rice Wet Dog Food, SmartBlend",$2.79
"Turkey and Venison Adult Wet Dog Food, True Instinct",$2.79
"Chicken, Carrot, and Peas Wet Dog Food, Grain Free",$2.99
"Beef, Rice and Vegetable Wet Dog Food, Prepared Meals",$2.99
"Rice and Lamb Stew Wet Dog Food, Prepared Meals",$2.99
"Simmered Chicken Medley Wet Dog Food, Prepared Meals",$2.99
Whitefish and Tuna Cat Food Paté,$0.99
"Chicken and Cheddar in Gravy Wet Cat Food, Delights",$0.99
"Adult Wet Cat Food Variety Pack, Medleys",$11.49
"Flaked Chicken Wet Cat Food Complement, Hors d'œuvre",$1.79
"Chicken Dry Dog Food for Large Breed, +Plus",$31.99
"Chicken Flavoured Small Breed Dog Food, ProActive He...",$18.99
"Adult Wet Cat Food Variety Pack, Medleys",$11.49
"Flaked Tuna Wet Cat Food Complement, Hors d'œuvre",$1.79
"Tuna Flavoured Wet Cat Food in Gravy, Perfect Portions",$1.49
"Salmon and Shrimp Flavoured Adult Cat Food, Seafood ...",$9.99
"Chicken Flavoured Wet Cat Food in Gravy, Perfect Por...",$1.49
"Salmon Flavoured Wet Cat Food in Gravy, Perfect Port...",$1.49
"Adult Dry Dog Food with Real Chicken, Complete",$20.99
Grilled Turkey in Gravy Wet Cat Food,$0.99
"Seafood Wet Cat Food Variety Pack, Pâté",$11.49
"Poultry Wet Cat Food Variety Pack, Poultry Pleaser",$11.49
"Chicken Flavoured Kittens Dry Cat Food, Proteine 1",$5.99
"Adult Dry Dog Food with Real Chicken, Complete",$33.49
"Beef and Bison Dry Adult Dog Food, True Instinct",$31.99
"Cod, Sole and Shrimp Wet Cat Food Pâté",$0.99
"Grilled Chicken and Seared Salmon Wet Cat Food, Petites",$13.99
"Chicken and Salmon Flavoured Wet Cat Food in Gravy, ...",$15.99
"Chicken and Shredded Beef Wet Cat Food Complement, H...",$1.79
"Chicken and Tuna Flavoured Wet Cat Food in Gravy, Pe...",$15.99
"Fish and Chicken Wet Cat Food Variety Pack, Gravy Lo...",$21.99
"Wild Alaskan Salmon Wet Cat Food Complement, Hors d'...",$1.79
Grain Free Adult Dog Food with Real Lamb,$16.99
Grain Free Chicken Flavoured Small Dog Food,$16.99
"Chicken, Turkey and Fish Flavoured Dry Cat Food",$11.99
"Chicken, Turkey and Fish Flavoured Dry Cat Food",$6.49
Gluten Free Devil'S Food Cake Mix,$6.99
"Chicken and Beef with vegetables Dry Adult Cat Food,...",$6.99
"Fish and Chicken Wet Cat Food Variety Pack, Gravy Lo...",$11.49
"Cod, Salmon and Sweet Potato Adult Wet Dog Food, Gra...",$2.99
Beef and Chicken Flavoured Wet Dog Food for Small Dogs,$19.99
"Wild Salmon, Egg and Pumpkin Adult Dry Dog Food, Sup...",$12.99
"Beef Flavoured Dry Food For Small and Medium Dogs, P...",$6.99
"Chicken And Brown Rice Recipe Adult Dog Food, Life P...",$23.99
"Chicken, Carrots and Green Peas Flavoured Dog Food, ...",$17.99
"Beef, Carrots and Green Peas Flavoured Dog Food, Pro...",$17.99
Healthy Adult™ salmon recipe and chicken recipe pâté...,$19.99
"Chicken, Carrots and Green Peas Flavoured Dry Cat Fo...",$5.99
"Wild Salmon and Braised Chicken Wet Cat Food Pâté, P...",$13.99
"Chicken, Carrots and Green Peas Flavoured Dry Cat Fo...",$19.99
New York Strip flavoured Slices for small dogs,$1.99
Entrées with Beef for Small Dogs,$1.99
Filet Mignon Flavoured Entrées for Small Dogs,$1.99
Entrées with Turkey for Small Dogs,$1.99
Entrées with Chicken and Liver for Small Dogs,$1.99
Pork Tenderloin and Top Sirloin Flavoured Entrées fo...,$19.99
Filet Mignon and Chicken & Liver Flavoured Entrées f...,$19.99
Prime Rib and Roast Turkey Flavoured Slices for Smal...,$19.99
Songbird Seed Mix,$9.88
Wild Bird Seed Mix,$14.98
Hickory Smoked Classic Cut Bacon,$7.99
"Fruity Ice Pops, Li'l Lolly",$5.49
Ice Cream Sandwiches,$7.49
"Triple Treat Ice Pops, Li'l Lolly",$5.49
"Lifesavers® Five Flavour Ice Pops, Life Savers",$7.49
Frozen Cheddar Cheese Flavoured Perogies,$2.27
"Grilled Balsamic Chicken, Gourmet Steamers",$5.49
"Pineapple Chicken, Gourmet Steamers",$5.49
"Frozen Grilled Chicken Marinara, Gourmet Steamers",$5.49
Frozen Butter Chicken with Basmati Rice,$3.99
Grilled Chicken Red Pepper Alfredo with Linguini & B...,$5.49
Frozen Chicken Teriyaki with Vegetables,$3.99
Frozen General Tao Chicken,$3.99
"Sweet Sesame Chicken, Gourmet Steamers",$5.49
Frozen Cheddar Cheese Flavoured Perogies,$4.27
Chocolate Brownie Flavoured Ice Cream Bars,$4.44
Cherry Flavoured Ice Cream Bars,$4.44
"Pistachio Flavoured Ice Cream Bars, The Creamiest",$4.44
Vanilla Flavoured Ice Cream Bars,$4.44
Frozen Bacon Perogies,$2.27
Frozen Mushroom and Wild Rice Burgers,$6.99
"Frozen Meatloaf with a Brownie, 0",$4.29
Frozen Chicken Strips with Bbq Dip,$4.29
Lactose Free Vanilla Ice Cream Sandwiches,$7.49
"Chicken Flavoured Cat Paté, Perfect Portions",$1.49
"Beef Flavoured Cat Paté, Perfect Portions",$1.49
"Salmon Flavoured Cat Paté, Perfect Portions",$1.49
"Chicken and Beef Flavoured Premium Cat Paté, Meaty S...",$16.99
Smoked Bacon,$7.99
"Whole Grain Oats Cereal, Cheerios",$4.99
"Oats Cereal Value Pack, Cheerios",$6.99
Organic Chicken Minestrone Soup Pouch for Babies 8+ ...,$2.79
Roasted Squash and Fruit Medley Flavoured Purée Pouc...,$2.29
Organic Juicy Pear and Garden Greens Flavoured Purée...,$2.29
Coconut Kiwi and Mangosteen with Quinoa Purée Pouch ...,$2.29
"Organic Apple, Blueberry and Spinach Baby Puree Pouc...",$2.49
"Organic Banana and Mango Purée Pouch, 6+ Months",$2.49
Organic Apple and Peach Baby Purée Pouch,$2.49
Hearty Vegetable with Turkey Purée Pouch for Babies ...,$2.79
"Sweet Potato, Apple and Chicken Organic Purée Pouch ...",$2.79
"Organic Vegetable Beef Bolognese and Pasta Puree, 8+...",$2.79
"Organic Apple Baby Puree Pouch, 6+ Months",$2.49
"Organic Apple, Sweet Potato and Berry Swirl Flavoure...",$2.29
"Organic Banana, Apple and Kale Blend Flavoured Purée...",$2.29
Yumberries and Plum with Ancient Grains Purée Pouch ...,$2.29
"Cherry, Orange and Grape Flavoured Icy Pop",$5.00
"Cherry, Orange and Lime Flavoured Icy Pops, Fruity F...",$5.00
"Pork Breakfast Sausages, Natural Sausage",$7.49
Fruit And Vegetable Reusable Bag,$2.99
White Cheddar Popcorn,$4.49
Movie Night Butter Popcorn,$4.49
Seasoned Lavered Seaweed,$2.50
Jalapeño and Cheddar Popcorn,$4.49
Glaze Mix For Fresh Strawberries,$1.98
"Frozen Pizza Wraps with Pepperoni,Mozzarella with to...",$10.00
T-shirt Non Woven Reusable Bag,3 /
Pork Dumpling,$5.29
Chicken Dumpling,$5.29
Foldable Box,$4.99
Vegetable Dumpling,$5.29
Beef Kimchi Dumpling,$5.29
"Baked macaroni & cheese, Main St Bistro",$6.49
"Baked scalloped potatoes, Main St Bistro",$6.49
"Signature Mashed Potatoes, Main St. Bistro",$4.49
"Roasted Garlic Mashed Potatoes, Main St. Bistro",$4.49
Avjar mild spread,$8.49
Avjar hot spread,$8.49
Roasted marinated red pepper,$5.49
"Bean and Rice Burrito Bowl, Street Food",$4.99
Garden Vegetables Baby Puree,$2.29
Turkey Vegetable Baby Puree,$2.29
Beef Vegetable Baby Puree,$2.29
"Organic Gluten Free Apples, Bananas, Blueberries and...",$2.49
"Organic Gluten Free Apples, Spinach, Kiwi, Broccoli ...",$2.49
"Organic Gluten Free Bananas, Strawberries, Peaches a...",$2.49
"Organic Tomato and Carrot Flavoured Corn Snacks, Lov...",$2.29
"Organic Gluten Free Apples, Sweet Potatoes, Carrots,...",$2.49
"Organic Black Bean, Sweet Corn, Chicken and Quinoa",$2.79
Banana Flavoured Organic Gluten Free Rice Rusks,$2.49
Apple Flavoured Organic Gluten Free Rice Rusks,$2.49
Organic Ripe Mango with Avocado and Oats Flavoured P...,$2.29
Prune Flavoured Organic Baby Purée,$2.29
"Organic Pear, Peach and Strawberry Baby Puree Pouch,...",$2.49
"Organic Gluten Free Pears, Bananas, Blackberries, Ra...",$2.49
Organic Autumn Pumpkin Pear and Beef Stew,$2.79
Pear Flavoured Organic Baby Purée,$2.29
Apple Flavoured Organic Baby Purée,$2.29
Banana Flavoured Organic Baby Purée,$2.29
Textured Vegetable Proteins,$5.99
Organic Oatmeal Baby Cereal,$5.99
"Organic Banana, Apple and Plum Purée for Babies 6+ M...",$1.17
"Organic Banana and Apple Purée for Babies 6+ Months,...",$1.17
Organic Berry and Coconut Flavoured Smoothie for Bab...,$2.29
"Organic Apple, Mango and Spinach Purée for Babies 6+...",$1.17
"Organic Apple, Banana and Blueberry Purée for Babies...",$1.17
Organic Pear and Butternut Squash Purée for Babies 6...,$1.17
"Organic Apple, Banana, Raspberry and Oatmeal Purée f...",$1.17
"Organic Apple, Carrot and Butternut Squash Purée for...",$1.17
Organic Apple and Carrot Purée for Babies 6+ Months,$1.17
Organic Pear and Green Bean Purée for Babies 6+ Months,$1.17
Organic Apple and Sweet Potato Purée for Babies 6+ M...,$1.17
Organic Tropical Green Smoothie 8+ Months,$2.29
"Organic Harvest Pear, Pumpkin and Banana Flavoured P...",$2.29
"Organic Vanilla, Banana, Berry and Risotto Flavoured...",$2.29
"Cinnamon, Chia and Baked Apple Flavoured Organic Purée",$2.29
Old Fashioned Apple Crisp Organic Purée Pouch for Ba...,$2.29
Organic Carrot & Apple Corn Snacks,$2.29
"Mango and Kiwi Flavoured Rice Biscuits, Toddler",$3.49
"Honey and Wheat Baby Cereal with Milk, Cerelac",$9.99
"Step 2 Powder Baby Milk, Pro-Advance",$61.99
"Step 1 Powder Baby Milk, Pro-Advance",$61.99
"Stage 2 Powder Baby Milk, Good Start",$33.99
Frozen Chocolate Flavoured Hazelnut Spread Sandwiche...,$12.99
"Strawberry and Apple Teethng Sticks, Soothe'n'Chew",$7.99
"Banana Flavoured Teething Sticks, Soothe'n'Chew",$7.99
Apple Flavoured Rice Rusks,$3.29
Banana Raisin Oatmeal Organic Wholegrain Cereal for ...,$5.99
Chicken Treats For Cats,$2.99
"Steak and Cheese Flavoured Dog Treats, Soft & Chewy",$2.49
Small Dog Biscuits,$2.99
Mixed Flavour Cat Treats,$1.99
Mixed Flavour Cat Treats,$1.99
"Frozen Blueberry Waffles, Thick & Fluffy",$3.99
"Frozen Cinnamon and Brown Sugar Flavoured Waffles, T...",$3.99
"Chicken,Tuna and Shrimp Flavoured Cat Treat, Squeeze Up",$12.99
"Frozen Buttermilk Waffles, Value Pack",$7.49
"Cat Treats, Stew",$13.99
"Frozen Whole Grain Waffles, Thick & Fluffy",$3.99
"Frozen Strawberry Delight Flavoured Waffles, Thick &...",$3.99
"Scented Clumping Cat Litter, LighWeight",$24.99
"Chicken And Tuna Flavoured Cat Treats, Squeeze Up",$6.99
"Snack Drink for Cats and Weaned Kittens, Catmilk",$2.49
Roll About Mouse™ Cat Toy,$6.49
"Flea and Tick Spray for Cats, Ultra Guard",$11.49
Medium Seal Top Storage Bags,$5.49
"Large Storage Bags, Slider",$5.49
Extra Large Seal Top Sandwich Bags,$3.79
Paper Lunch Bag,$2.79
Poultry and Porc Oven Bags,$2.99
20cm Resuable Plastic Straws,$1.99
Cremini Mushrooms,$4.98
Lemon Pudding Cake with Icing,$5.49
Artisan Cranberry and Orange Scones,$5.99
Sandwich bags,$4.49
Marble Chocolate Coffe Cake,$8.99
Sugar Snap Peas,$4.98
Syrup waffle flavoured cookies,$3.49
Okra,$3.98
Mini Lemon Tarts,$3.99
"Clumping Cat Litter, LighWeight",$24.99
Clump and Seal™ Cat Litter,$19.99
Plant-Based Breakfast Links,$5.88
Italian Eggplant,$1.71
Chinese Eggplant,$0.87
Angelino Plums,$5.98
"Seafood Medley Flavoured Cat Treats, Mega-Pack",$3.49
Chickpea salad,$8.99
"Beef Flavoured Cat Treats, Mega-Pack",$3.49
"Salmon Flavoured Cat Treats, Mega-Pack",$3.49
"Turkey Flavoured Cat Treats, Mega-Pack",$3.49
Summer rotini salad,$8.99
Grey Squash Zucchini,$1.34
Sweet Kale Chopped Salad Kit,$7.98
"Creamy Dairy Flavoured Cat Treats, Mega-Pack",$3.49
"Free Range Chicken Flavoured Cat Treats, Mega-Pack",$3.49
Bean medley salad,$4.69
Pad thai salad,$4.69
Red skin potato salad,$8.99
"Ginger and sesame salad kit, Chop Chop",$4.98
Green Hot Finger Pepper,$0.99
Black Plums,$5.98
Veggie Burgers,$9.99
Large Seal Top Storage Bags,$5.49
"Medium Freezer Bags, Slider",$5.49
"Large Freezer Bags, Slider",$5.49
Resealable Snack Bags,$5.49
Cat litter deodorizer,$2.99
"Frozen Original Waffles, Thick & Fluffy",$3.99
"Frozen Buttermilk Pancakes, Value Pack",$7.49
"Chicken in Gravy Cat Treats, Party Mix",$2.99
"Chicken Cat Treats, Party Mix",$2.99
"Whitefish Cat Treats, Party Mix",$2.99
"Chicken Cat Treats, Party Mix",$2.99
Italian Tomato,$0.44
Berry Flavoured Organic Rice Rusks,$3.49
Extra Large Freezer Bags,$8.49
"Cauliflower Florets, Organic",$3.99
Original Hash Brown Patties,$10.99
Cheese and Spinach Flavoured Frozen Ravioli,$10.00
"Frozen Whole Kernel Corn, Organic",$3.99
Frozen Farm Potato Pierogies,$3.49
Frozen Potato and Cheddar Cheese Pierogies,$3.49
Frozen Potato and 3 Cheese Pierogies,$3.49
Frozen Potato and Onion Pierogies,$3.49
Frozen Potato and Jalapeño Pierogies,$3.49
"Original Cereal, All-Bran",$5.49
Frozen Spring Roll Dough,$4.19
Frozen Sesame Flavoured Glutinous Rice Balls,$2.79
Frozen Peanut Flavoured Glutinous Rice Balls,$2.79
Walnut Butter Tarts,$4.99
"Unsweetened Original Flavour Almond Beverage, So Fresh",$3.49
Smoked Sriracha Tofu,$3.98
Frozen Organic Enchilada with Spanish Rice and Beans,$7.49
"Small Slicker Brush for Cats & Small Dogs, Groomer's...",$9.49
Organic Sweet Potato and Carrot Rice Rusks,$3.49
Evaporated coconut milk,$2.99
"Frozen Original Waffles, Value Pack",$13.99
Jalapeño Pepper,$0.31
"Chicken Flavoured Cat Treats, Mega-Pack",$3.49
Ready-To-Use Milk-Based Iron Fortified and Calcium-E...,$67.99
Ready-To-Use Milk-Based Iron Fortified Step 1 Infant...,$67.99
Organic Blueberry and Goji Rice Rusks,$3.49
Green Beans,$3.98
Sugar Snap Peas,$6.99
"Tuna Flavoured Cat Treats, Mega-Pack",$3.49
"Chicken Cat Treats, Squeeze Up",$2.99
Plant-Based Spicy Italian Sausages,$5.99
Cheddar Style Cheese Slices,$5.98
Gluten Free Smoked Gouda Style Block Cheese,$5.98
Large Seal Top Freezer Bags,$5.49
Pecan butter tarts,$4.99
Medium Seal Top Freezer Bags,$5.49
Raisin Butter Tarts,$4.99
"Tropical Fruit Flavoured Gummies, Real Fruit",$4.29
"Fruit Medley Flavoured Jelly Gummies, Realfruit",$4.29
Navy Beans,$3.49
Split Yellow Peas,$3.49
Split Green Peas,$3.49
Roasted Red Pepper Hummus with Pretzels,$1.99
Jumbo Lima Beans,$6.99
Split Red Lentils,$6.99
"Super Fruit Flavoured Jelly Gummies, Realfruit",$4.29
Veggie Burgers,$6.88
Frozen Cinnamon Waffles,$2.77
Frozen Homestyle Waffles,$4.99
Vanilla Frosted Sugar Cookies,$4.99
Iron Fortified Infant Formula Powder Eco Refills for...,$62.99
Iron-Fortified Milk-Based Infant Formula for Babies ...,$38.99
Frozen Meatless Meatballs,$6.99
"Organic Red Berry Flavoured Baby Yogurt Melts, 12+ M...",$4.99
"Organic Honey Flavoured Baby Biscuits, 12+ Months",$4.99
Medium Couscous,$3.99
Original Flavour Almond Beverage,$3.49
Dark red kidney beans,$2.99
Greek feta pasta salad,$4.69
Frozen Potato and Cheddar Cheese Pierogies,$3.49
Gluten Free Medium Cheddar Block Cheese,$5.98
Garlic and Fennel Italian Vegan Sausages,$6.99
Smoked Tofu,$3.98
Macaroni & Cheddar Cheese,$6.99
"Oat, Fruit and Veggie Bars",$4.79
Seal Top Sandwich Bags,$5.49
Coconut Milk,$3.29
Coconut Milk,$2.49
Powdered Coconut Milk,$4.99
Coconut Cream,$4.99
Coconut Milk,$4.99
Coconut Milk Powder,$1.29
Light Red Kidney Beans,$4.49
Pinto Beans,$4.49
Seal Top Sandwich bags,$8.99
Resealable Sandwich Bags,$6.99
"Vegan Burger Patties, Chef's Signature",$8.88
Organic Strawberry and Banana Flavoured Yogurt Baby ...,$4.99
Great Northern Bean,$4.19
Assorted Apple and Fruit Sauce Pouches,$10.99
Smoked Apple and Sage Plant-Based Sausages,$6.99
Vegan Peanut Free Simply Almond Granola,$10.99
Vegan Peanut Free Apple Cranberry Granola,$10.99
Large Peach,$1.62
"Milk Based Infant Formula 0-12 Months, A+",$73.49
Rainbow Sorbet,$7.49
Triple Berry Sorbet,$7.49
Hummus with Pretzels,$1.99
Green Lentils Laird,$3.69
Medium Homemade Style Mexican Salsa,$3.99
Mild Homemade Style Mexican Salsa,$3.99
Chick Peas,$3.49
Hot Homemade Style Mexican Salsa,$3.99
White Kidney Beans,$3.49
Frozen Plant Egg,$7.99
Frozen 3-Cheese Perogies,$2.27
Frozen Spinach and Feta Perogies,$2.27
Extra Firm Tofu,$2.98
Organic Extra Firm Tofu,$3.98
Roasted Garlic Hummus,$4.69
Mini Pecan Butter Tarts,$3.99
Mini Butter Tarts,$3.99
Roasted Red Pepper Hummus,$4.69
"Hummus, Snack n' Go",$4.69
Whole Black Beans,$3.29
Whole Pinto Beans,$3.29
Large Double Zipper Freezer Bags,$4.99
Red Berries Jujube Candy,$1.25
Shark Gummy Candy,$1.25
Sour Peach Ring Candy,$1.25
Gummy Bears Candy,$1.25
Sour Gummy Worms Candy,$1.25
Frozen Spinach and Cheese Manicotti,$12.99
Mini Seedless Watermelon,$3.98
Extra Large Double Zipper Freezer Bags,$4.99
Black Turtle Beans,$3.49
Black Eye Peas,$4.19
Frozen Mandarin and Orange Plant-Based Crispy Chick'n,$6.99
Frozen Lightly Breaded Plant-Based Turk'y Cutlets,$6.99
"Frozen Crustless Spinach, Ricotta and Caramelized On...",$4.49
Hothouse Red Tomato,$1.09
Black Plum,$0.88
Roasted Red Pepper Hummus,$5.29
Chickpeas and Roasted Pinenuts Hummus,$5.29
Spicy Pepper Hummus,$5.29
Frozen New York Style Cherry Cheesecake,$11.49
Hot Homemade Style Green Salsa,$3.99
Vegan Margarine,$4.99
"Medium Seal Top Freezer Bags, Value Pack",$12.99
Mega Seal Top Sandwich Bags,$12.99
Uncooked Plant-Based Ancient Grains Chick'N Tenders,$6.99
"Frozen Beefless Ground, The Ultimate",$6.99
Fresh Mint Flavoured Mints,$1.99
Fruit Adventure Flavoured Mints,$1.99
Vegetable Soup Mix,$2.29
Orange Flavoured Mints,$1.99
"Cherry Flavoured Candy, Super Nibs",$3.99
"Cherry Flavoured Candy, Nibs",$3.99
Frozen Organic Indian Mattar Paneer,$7.49
Sour Fruit Flavoured Candy,$3.49
Mixed Beans,$4.49
Split Red Lentils,$3.49
Green Pepper,$1.81
Large Freezer Bags,$5.99
Balady Brown Lentils,$3.49
Hothouse Orange Pepper,$2.63
Seedless Watermelon,$6.98
Hothouse Yellow Pepper,$2.63
Hothouse Red Pepper,$2.63
Frozen Chipotle-Lime Plant-Based Crispy Fingers,$6.99
Plain Extra-Firm Tofu,$2.98
"Mixed Fruit Flavoured Gummies, Realfruit",$2.49
"Super Fruit Flavoured Gummies, Realfruit",$2.49
Mac'n cheese salad,$8.99
Cucumber,$1.98
Pumpkin Pie,$7.99
Refried Beans,$3.99
Frozen Breakfast Potatoes,$10.99
Honeydew,$4.99
Banana Flavoured Rice Rusks,$3.29
Frozen Gluten Free Margherita Pizza,$10.49
Original Fruit Flavoured Candy,$3.49
Licorice Twists,$3.99
"Original Gummies, Gummies",$3.49
"Berry Flavoured Gummies, Gummies",$3.49
Frozen Organic Cheddar Cheese Burrito,$5.49
Jumbo Bean Mix,$2.99
"Organic Sweet Bell Peppers, Organics",$4.98
Whole Wheat Cereals,$4.99
Jumbo Roadhouse Salted Peanuts,2 /
Frozen Beans and Rice Burrito,$5.49
Frozen Vegan Chili Bowl,$3.99
Plant-Based Simulated Ground Beef,$8.99
Black Beans,$1.79
White Kidney Beans (Cannellini Beans),$1.79
Large Seal Top Freezer Bags,$12.99
Vegan Margarine,$8.99
"Avocado Ranch Salad Kit, Chop Chop",$4.98
Donut Flavoured Vegan Gluten Free Protein Bar,$2.79
Large All-Purpose Bags,$5.99
Ready To Feed Milk-Based Iron Fortified Infant Formu...,$69.99
Cookie Dough Flavoured Vegan Gluten Free Protein Bar,$2.79
Dark Chocolate and Almond Flavoured Organic Gluten F...,$2.99
Vegan Gluten Free Peanut Butter Protein Bar,$2.79
"Frozen Organic Waffles, Homestyle",$5.79
English Cucumber,$1.98
Unscented Clumping Cat Litter,$8.99
Scented Clumping Cat Litter,$8.99
White Navy Beans,$2.99
Low Sodium Vegetable Cocktail,$4.49
"Frozen Crustless 4 Cheese and Ham Quiche, Egg Bakes",$4.49
White Kidney Beans,$2.99
Original Flavoured Selected Superior Rice Rusks,$3.29
Bag of Bean Sprouts,$1.98
Cherry Pull 'N' Peel Candy,$3.99
Frozen 5-Cheese Macaroni,$9.99
English Style Toffee Coffee Cake,$8.99
Organic Gluten Free Dried Apricots,$4.98
"Frozen Pineapple Chunks, Organic",$4.44
Plant-Based Ground Round,$13.99
Plant-Based Mild Italian Sausages,$8.99
Plant Based Burger,$19.99
Hummus,$4.69
"Original Vegetable Juice, Garden Cocktail",$4.99
"Frozen Blueberry Flavoured Waffles, Value Pack",$7.49
"Low Sodium Vegetable Juice, Garden Cocktail",$4.99
Mini Hummus Single Servings,$4.99
"Choco-Hazelnut Cake, Fusion",$16.99
Assorted Hot House Sweet Bell Peppers,$4.98
Green Lentils,$2.99
Yellow Split Peas,$1.99
Chick Peas,$2.99
Red Kidney Beans,$2.99
Original Caesar Salad Preparation Kit,$5.98
Frozen Organic Chicken Wings,$17.99
Jumbo Cantaloupe,$3.98
Milk Chocolate Egg with Surprise Toy,$1.79
Sweetened Coconut Flakes,$1.99
Walnut Halves,$2.77
"Frozen Cheddar, Mushroom and Bacon Crustless Quiche,...",$4.49
Eggplant,$3.29
"Organic Divine Grape™ Kombucha, Synergy",$4.29
Green Beans,$0.66
Mango Sorbet,$4.44
Raspberry Sorbet,$4.44
Lemon Sorbet,$4.44
Resealable Sandwich Bags,$2.99
Condensed Vegetable Soup,$0.99
Roasted Red Pepper Hummus,$5.99
"Mini Black and White Chocolate Cheesecakes, Mini Tuxedo",$8.49
"Red Velvet Cake, Fusion",$16.99
Organic Red Cluster Tomatoes,$6.80
Milk Chocolate Egg with Surprise Toy,$1.79
Large Freezer Bags,$2.99
"Corn Bran Toasted Cereal, Squares",$4.99
Cremini Mushrooms,$2.98
Greek Pasta Salad,$8.99
Frozen Whole Wheat Waffles,$2.77
Packed Sweet Corn,$4.88
Bean and Rice Burrito,$5.49
Pad Thai salad,$8.99
Organic Gingerade™ Kombucha,$4.29
"Frozen Homestyle Waffles, Value Pack",$12.99
Organic Trilogy™ Kombucha,$4.29
Organic Strawberries,$5.98
Frozen Plant-Based Seven Grain Chick’n Tenders,$6.99
Original Vegetable Cocktail,$4.49
Unsweetened Vanilla Flavoured Almond Plant-Based Bev...,$4.79
Red Kidney Beans,$1.79
Mild Salsa,$5.99
Medium Salsa,$5.99
French Green Beans,$4.98
Original Vegetable Cocktail,$4.49
Hot Salsa,$4.99
Medium Freezer Bags,$2.99
Milk Chocolate Covered Wafers with Milky Hazelnut Fi...,$1.79
Medium Mango Salsa,$4.99
"Frozen Cinnamon Toast Waffles, Value Pack",$7.49
Frozen Chocolate Chip Waffles,$2.77
Mild Extra Chunky Salsa,$4.44
Vegan Dressing and Sandwich Spread,$6.49
Sweet Kale Chopped Salad Kit,$4.98
Craft Bar Mix,$4.99
Frozen Organic Skinless Chicken Breasts,$28.99
Plant-Based Burger,$7.49
Original Flavour Unsweetened Almond Plant-Based Beve...,$4.79
Strawberry Twists,$3.99
"Scented Clumping Cat Litter, Value Pack",$9.99
"California Sun-Dried Raisins, Mini-Packs",$4.49
"Original Flavour Organic Almond Beverage, So Nice",$4.49
"Frozen Chocolatey Chip Waffles, Value Pack",$7.49
Medium Extra Chunky Salsa,$4.44
100% Carrot Juice,$5.98
Frozen Blueberry Waffles,$2.77
Chopped Walnuts,$7.49
"Frozen Hash Brown Sticks, All-Day Breakfast",$4.29
"Frozen Chopped Kale, Organic",$3.99
Triple Chocolate Trifle Cake,$7.99
Dulce de Leche Flavoured Trifle Cake,$7.99
"Frozen Mixed Berries, Organic",$4.44
"Frozen Sliced Strawberries, Organic",$4.44
"Frozen Potato Patties, 9 Minute Breakfast",$4.99
Walnut Pieces,$7.49
"Frozen Assorted Vegan Bites, Plant-Based",$7.99
Sliced White Mushrooms,$2.98
Local Mini Cucumbers,$3.98
Almond Plant-Based Beverage,$4.79
Traditional Hummus,$5.99
"Natural Whole Grain Wheat Cereal, Shredded Wheat",$4.99
Medium Salsa,$2.99
Walnut Pieces,$2.77
"Honey Almond Flax Cereal, Golean Crunch!",$6.49
Shredded Sweetened Coconut,$1.99
Lemon Loaf Cake Slices,$4.99
Bacon Caesar Salad Kit,$4.98
"Frozen Pitted Dark Sweet Cherries, Organic",$4.44
Sierra Mountain Trail Mix,$3.49
"Chocolate Crunch Cereal, Golean",$6.49
Organic Multigrain Flakes Cereal,$9.99
Assorted Apple and Fruit Sauce Pouches,$10.99
Assorted Apple and Fruit Sauce Pouches,$10.99
Organic Chicken Drumsticks,$14.99
Zucchini,$1.34
"Unsweetened Apple Sauce, Fruitsations",$2.99
Low Sodium Vegetable Cocktail,$4.49
"Original Apple Sauce, Fruitsations",$2.99
Frozen Onion Hash Brown Patties,$6.49
Gluten Free Deluxe Mixed Nuts,$11.88
Frozen Homestyle Waffles,$2.77
Buttermilk Pancakes,$2.77
